{
  "note_id": "note_0001",
  "timestamp": "2026-01-07T09:15:00-05:00",
  "sphere": "tech",
  "sector": "platform",
  "intent_summary": "Définir l’activation du stagiaire uniquement en fin de conversation + cooldown 15 minutes.",
  "ambiguities": [
    "Définition UX de la fin de conversation (message de clôture vs inactivité vs bouton)"
  ],
  "outsourcing_used": false,
  "outsourcing_reason": null,
  "user_signal": "approve",
  "learning_value": "high",
  "recurrence_estimate": "med",
  "priority": "high",
  "question_candidate": "Quel signal UX définit le mieux la fin de conversation dans CHE-NU (bouton, inactivité, message de clôture) ?",
  "promotion_status": "candidate"
}